{
  "version": 1,
  "name": "Wisteria Dawn",
  "tags": [
    "blossom",
    "spring",
    "wisteria",
    "lavender",
    "floral",
    "gentle",
    "fresh"
  ],
  "colors": [
    "#2e2840",
    "#8c6bb1",
    "#c8a8e0",
    "#a3d9b1",
    "#f6f1fa"
  ],
  "source": "ai",
  "createdAt": "2026-06-23"
}
